AMC_No,AMC_Name
058062 , Southern California Center for Sports Medicine
050507 , Southern California Health & Rehabilitation Program
058070 , Southern California Orthopedic Institute
058185 , Southern California Permanente Medical Group (San Diego)
058241 , Southern California Reproductive Center (Beverly Hills)
059774 , Southern California Reproductive Center-Santa Barbara
050408 , Southern California System of Clinics
058280 , Specialty Surgical Center of Beverly Hills
058207 , Sports Clinic Orthopaedic Medical Associates Inc
058227 , Sports Orthopedic and Rehabilitation (SOAR) Medicine Associates
058133 , St Agnes Medical Center (Fresno)
058218 , St Anne's Maternity Home
059642 , St Bernardine Medical Center-Dignity Health
059800 , St Francis Medical Center
050162 , St Francis Memorial Hospital
059767 , St Helena Clearlake Hospital
059585 , St John's Cancer Institute
058079 , St John's Regional Medical Center
059699 , St Joseph Health-St Mary Medical Center
059874 , St Joseph Heritage Healthcare-Humboldt
058173 , St Joseph Hospital (Orange)
059780 , St Joseph Hospital-Eureka
058112 , St Joseph's Medical Center
058276 , St Joseph's Occupational Health Center
059624 , St Jude Medical Center
059552 , St Leo Mission Medical Clinic
057077 , St Luke Medical Center
050212 , St Luke's Hospital
050267 , St Mary Medical Center
050163 , St Mary's Hospital and Medical Center
058137 , St Vincent de Paul Village Medical Clinic
050382 , St Vincent Medical Center
058192 , Stanford Blood Center
059637 , Stanford Center for Clinical Informatics
050129 , Stanford Health Care
058264 , Stanislaus County Community Health Clinics
058102 , Stanislaus County Health Services
050079 , Storm Nutrition
050362 , Success in Recovery-Residential Treatment Facility
059758 , Suha R Newhide MD-Peds/Neonatology Office
050352 , Sunrise Health & Wellness
058219 , Superior Court of California
058239 , Surgery Center of Long Beach
058217 , Surgery Center of the Pacific
050219 , Sutter Amador Hospital
058233 , Sutter Center for Psychiatry
050728 , Sutter Davis Hospital
050415 , Sutter Gould Medical Foundation
058085 , Sutter Health
050241 , Sutter Medical Center-Sacramento
058084 , Sutter Memorial Hospital
050328 , Sutter Roseville Medical Center
050152 , Sutter Santa Rosa Regional Hospital
059636 , Tahoe Forest Hospital District
050059 , Tarzana Treatment Center-Tarzana
050150 , Temecula Center for Cardiac Care
050480 , Temecula Valley High School Athletic Department
059808 , Temecula Valley Hospital
050481 , Temecula Valley Pro Warner Football-Athletic Department
050044 , Temescal Valley Clinic-Riverside Medical Clinic
050134 , The Neuron Clinic
050509 , Therapy Pros
058204 , Thornton Hospital
059783 , Torrance Refining Company LLC
050302 , Touro University Medical Group
050355 , Transitions Buprenorphine Clinic of Sacramento
058253 , Treasure Island Job Corps
058031 , Tri-City Medical Center
058229 , Trinity Care Hospice
050168 , TriValley Urology
058155 , Truckee Tahoe Medical Group
058309 , Truckee Tahoe Medical Group (Squaw Valley)
059550 , Tulare County Mental Health
050361 , Tulare County Office of Education-Behavioral Health Services
050258 , Tulare Rural Health Center
059857 , Tulare Youth Service Bureau
058195 , Twin Towers Correctional Facility-Jail Mental Health Service
059577 , UC San Diego Health Systems
059508 , UC San Diego Sulpizio Cardiovascular Center
058284 , UCD Cowell Student Health
059525 , UCLA Counseling and Psychological Services
059503 , UCLA David Geffen School of Medicine/UCLA Medical Center
050781 , UCLA Medical Center-Jules Stein Eye Institute
050722 , UCLA Neuropsychiatric Hospital
050066 , UCLA Pain Management Center
050514 , UCLA School of Public Health
050312 , UCLA Westwood Medical Center
059723 , UCR Health Neurosciences
050554 , UCSF and Mount Zion Medical Centers
050110 , UCSF Benioff Children's Hospital-Oakland
059501 , UCSF Fresno Medical Education Program
050122 , UCSF Med Ctr/Langley Porter Psychiatric Hospital and Clinics
058283 , UCSF Medical Center
059579 , UCSF Moffitt Long Hospital
059802 , UHS Southern California Medical Education Consortium
050323 , United Advocates for Children and Families
058291 , United States Postal Service Occupational Health Department
058226 , University Centers of Excellence
059605 , University Dermatology Group-San Diego
058222 , University Health Services (Tang Center)
050436 , University of California (Davis) Medical Center
059502 , University of California (Davis) School of Medicine
050564 , University of California (Irvine)
050741 , University of California (Irvine) College of Medicine
050434 , University of California (San Diego) Medical Center
050737 , University of California (San Francisco) School of Medicine
058115 , University of California Davis Health
059747 , University of California Riverside Health
059511 , University of California Riverside School of Medicine
059562 , University of California Riverside-Athletic Training Room
058205 , University of California San Diego Cancer Center
050376 , University of California School of Public Health
059788 , University of California-Riverside Early Childhood Services
059565 , University of La Verne-Athletic Training Room
058256 , University of San Diego Law School
050753 , University of Southern California School of Medicine
058116 , University of Southern California/LAC+USC Medical Center
059670 , University Oncology Associates
058278 , Urogynecology and Pelvic Reconstructive Surgery
059595 , Urology Associates of San Luis Obispo
058277 , US Healthworks Medical Group
059695 , US HealthWorks Medical Group
058150 , US Navy Environmental and Prevention
058209 , USC Orthopaedic Surgery
059853 , USC Verdugo Hills Hospital
059590 , USC-Department of Dermatology (Keck School of Medicine)
059589 , USC-Keck Healthcare Consultation Center II
050581 , VA Central California Health Care System
058105 , VA Greater Los Angeles Healthcare System
059721 , VA Loma Linda Healthcare System
050186 , VA Long Beach Healthcare System
058100 , VA Northern California Health Care System
058118 , VA Northern California Health Care System
050589 , VA San Diego Healthcare System
050121 , Vaden Student Health Center at Stanford University
059749 , Valenta Inc
059676 , Valley Children's Healthcare
057058 , Valley Children's Hospital
058263 , Valley Consortium for Medical Education
059731 , Valley Health Team Inc
058119 , Venice Family Clinic
050222 , Ventura County Behavioral Health-North Oxnard Clinic
050324 , Ventura County Medical Center
058146 , Veteran Affairs Medical Center (Los Angeles)
058156 , Veteran Affairs Medical Center (Martinez)
050763 , Veterans Affairs Medical Center (Livermore)
050113 , Veterans Affairs Medical Center (San Francisco)
050273 , Veterans Affairs Palo Alto Health Care System
059627 , Veterans Home of California West Los Angeles
059597 , Visalia Medical Clinic
058220 , Vista Del Mar Child & Family Services
059724 , Vitas Healthcare (San Diego)
059887 , Vitas Healthcare-Covina
059524 , Vitas Innovative Hospice Care-Encino
059641 , Vitas Innovative Hospice Care-Irvine
050184 , VNA Hospice & Palliative Care of Southern California
050266 , Washington Hospital Healthcare System
058161 , West Anaheim Medical Center
050286 , West Century Medical Center
059708 , West Health Institute
058307 , West Los Angeles Healthcare Center
059542 , Whittier College Training Room
058208 , Willow Medical Center
058093 , Women's and Children's Hospital
059677 , Women's Community Clinic
050354 , Yellow Wood Recovery
050133 , Yolo County Health and Human Services
058069 , Yolo County Mental Health Services
059640 , Yosemite National Park Medical Clinic
050334 , Zuckerberg San Francisco General Hospital
